{
  "schemaVersion": "0.2.0-oa",
  "maturityAssessmentId": "mat:oa-confirmed-001",
  "projectId": "prj:campus360-oa",
  "subjectRef": "pack:v3-native-option-a-modeled",
  "dimensions": [
    {
      "dimensionId": "modeled-contracts",
      "proposedLevel": "MODELED",
      "confirmedLevel": "MODELED"
    }
  ],
  "proposedLevel": "MODELED",
  "confirmedLevel": "MODELED",
  "claimEvaluationRefs": [
    "clm:structural-001"
  ],
  "reviewBundleRefs": [
    {
      "reviewBundleId": "rb:oa-accepted-001",
      "version": 3
    }
  ],
  "evidenceRefs": [
    "ev:manual-001",
    "ev:external-001"
  ],
  "blockingReservationRefs": [],
  "proposedBy": {
    "actorId": "actor:studio",
    "role": "system",
    "displayName": "Studio",
    "authorityLevel": "none"
  },
  "confirmedBy": {
    "actorId": "actor:morris",
    "role": "decision_maker",
    "displayName": "Morris",
    "authorityLevel": "N3"
  },
  "proposedAt": "2026-07-26T00:00:00.000Z",
  "confirmedAt": "2026-07-26T02:00:00.000Z",
  "status": "confirmed",
  "autoPromoted": false,
  "provenance": {
    "schemaVersion": "0.1.0-oa",
    "provenanceRecordId": "prv:mat-confirmed-001",
    "actor": {
      "actorId": "actor:morris",
      "role": "decision_maker",
      "displayName": "Morris",
      "authorityLevel": "N3"
    },
    "source": "review",
    "timestamp": "2026-07-26T00:00:00.000Z",
    "correlationId": "corr:oa-t-a6-001"
  }
}
