{
  "schemaVersion": "0.2.0-oa",
  "maturityAssessmentId": "mat:oa-superseded-001",
  "projectId": "prj:campus360-oa",
  "subjectRef": "pack:v3-native-option-a-modeled",
  "proposedLevel": "VALIDATED",
  "confirmedLevel": "VALIDATED",
  "claimEvaluationRefs": [
    "clm:not-proven-001"
  ],
  "reviewBundleRefs": [
    {
      "reviewBundleId": "rb:oa-incomplete-status-001",
      "version": 2
    }
  ],
  "evidenceRefs": [
    "ev:stale-001"
  ],
  "proposedBy": {
    "actorId": "actor:studio",
    "role": "system",
    "displayName": "Studio",
    "authorityLevel": "none"
  },
  "confirmedBy": {
    "actorId": "actor:morris",
    "role": "decision_maker",
    "displayName": "Morris",
    "authorityLevel": "N3"
  },
  "proposedAt": "2026-07-26T00:00:00.000Z",
  "confirmedAt": "2026-07-26T01:00:00.000Z",
  "status": "superseded",
  "supersedesMaturityAssessmentId": "mat:oa-confirmed-001",
  "downgradeReason": "Prior MODELED confirmation invalidated after evidence became stale/unavailable",
  "autoPromoted": false,
  "provenance": {
    "schemaVersion": "0.1.0-oa",
    "provenanceRecordId": "prv:mat-superseded-001",
    "actor": {
      "actorId": "actor:morris",
      "role": "decision_maker",
      "displayName": "Morris",
      "authorityLevel": "N3"
    },
    "source": "review",
    "timestamp": "2026-07-26T00:00:00.000Z",
    "correlationId": "corr:oa-t-a6-001"
  }
}
